{
  "clusters": [
    {
      "alignment_confidence": "high",
      "assessment": "均服务于“不要跳过真声直接练混声”的入门训练路线；R2保留的步骤最完整，Q7的高光句相对简略。",
      "canonical_topic": "真声到强混、假声的训练顺序",
      "cluster_id": "t011",
      "members": [
        {
          "anonymous_system_id": "Q7",
          "assessment": "x",
          "candidate_id": "candidate_005f7d0822d40234",
          "claim_fidelity": 4,
          "editorial_value": 4,
          "expression_completeness": 3,
          "highlight_id": "h05",
          "hook_strength": 3,
          "representative_quality": 3,
          "title_copy_quality": 3
        },
        {
          "anonymous_system_id": "R2",
          "assessment": "x",
          "candidate_id": "candidate_005f7d0822d40234",
          "claim_fidelity": 4,
          "editorial_value": 4,
          "expression_completeness": 4,
          "highlight_id": "h07",
          "hook_strength": 3,
          "representative_quality": 4,
          "title_copy_quality": 4
        },
        {
          "anonymous_system_id": "M4",
          "assessment": "x",
          "candidate_id": "candidate_005f7d0822d40234",
          "claim_fidelity": 4,
          "editorial_value": 4,
          "expression_completeness": 4,
          "highlight_id": "h01",
          "hook_strength": 4,
          "representative_quality": 3,
          "title_copy_quality": 4
        }
      ]
    },
    {
      "alignment_confidence": "high",
      "assessment": "两条都是同一连麦对象的咬字、舌根与腰腹支撑诊断，能够满足真实案例点评的同一编辑需求。",
      "canonical_topic": "连麦唱歌诊断：有气但用不上",
      "cluster_id": "t021",
      "members": [
        {
          "anonymous_system_id": "R2",
          "assessment": "x",
          "candidate_id": "candidate_22d3260a7179c022",
          "claim_fidelity": 4,
          "editorial_value": 4,
          "expression_completeness": 4,
          "highlight_id": "h06",
          "hook_strength": 4,
          "representative_quality": 4,
          "title_copy_quality": 4
        },
        {
          "anonymous_system_id": "M4",
          "assessment": "x",
          "candidate_id": "candidate_22d3260a7179c022",
          "claim_fidelity": 4,
          "editorial_value": 4,
          "expression_completeness": 4,
          "highlight_id": "h08",
          "hook_strength": 3,
          "representative_quality": 4,
          "title_copy_quality": 4
        }
      ]
    },
    {
      "alignment_confidence": "high",
      "assessment": "两条均回答中老年人能否开始学唱歌，M4避开了候选中容易误导的天赋上下限表述。",
      "canonical_topic": "成年人开始学唱歌并不晚",
      "cluster_id": "t031",
      "members": [
        {
          "anonymous_system_id": "R2",
          "assessment": "x",
          "candidate_id": "candidate_260b8f35571eae11",
          "claim_fidelity": 4,
          "editorial_value": 3,
          "expression_completeness": 4,
          "highlight_id": "h10",
          "hook_strength": 4,
          "representative_quality": 2,
          "title_copy_quality": 3
        },
        {
          "anonymous_system_id": "M4",
          "assessment": "x",
          "candidate_id": "candidate_260b8f35571eae11",
          "claim_fidelity": 4,
          "editorial_value": 4,
          "expression_completeness": 4,
          "highlight_id": "h09",
          "hook_strength": 4,
          "representative_quality": 4,
          "title_copy_quality": 4
        }
      ]
    },
    {
      "alignment_confidence": "high",
      "assessment": "三条都纠正刻意控制或压低舌头、导致舌部紧张的误区，并给出下牙齿后方的替代位置。",
      "canonical_topic": "唱歌时的舌头放松与位置",
      "cluster_id": "t041",
      "members": [
        {
          "anonymous_system_id": "Q7",
          "assessment": "x",
          "candidate_id": "candidate_2efa31efddfe10ed",
          "claim_fidelity": 4,
          "editorial_value": 4,
          "expression_completeness": 3,
          "highlight_id": "h03",
          "hook_strength": 4,
          "representative_quality": 3,
          "title_copy_quality": 3
        },
        {
          "anonymous_system_id": "R2",
          "assessment": "x",
          "candidate_id": "candidate_2efa31efddfe10ed",
          "claim_fidelity": 4,
          "editorial_value": 4,
          "expression_completeness": 4,
          "highlight_id": "h03",
          "hook_strength": 4,
          "representative_quality": 4,
          "title_copy_quality": 4
        },
        {
          "anonymous_system_id": "M4",
          "assessment": "x",
          "candidate_id": "candidate_2efa31efddfe10ed",
          "claim_fidelity": 4,
          "editorial_value": 4,
          "expression_completeness": 4,
          "highlight_id": "h06",
          "hook_strength": 4,
          "representative_quality": 4,
          "title_copy_quality": 4
        }
      ]
    },
    {
      "alignment_confidence": "high",
      "assessment": "均为同一练习片段，核心是按体能缩短单次时长并分散练；R2保留了可执行的具体时长。",
      "canonical_topic": "气息练习的单次时长与分散频率",
      "cluster_id": "t051",
      "members": [
        {
          "anonymous_system_id": "Q7",
          "assessment": "x",
          "candidate_id": "candidate_4305cfa07f8b1fbf",
          "claim_fidelity": 4,
          "editorial_value": 4,
          "expression_completeness": 3,
          "highlight_id": "h09",
          "hook_strength": 4,
          "representative_quality": 3,
          "title_copy_quality": 3
        },
        {
          "anonymous_system_id": "R2",
          "assessment": "x",
          "candidate_id": "candidate_4305cfa07f8b1fbf",
          "claim_fidelity": 4,
          "editorial_value": 4,
          "expression_completeness": 3,
          "highlight_id": "h05",
          "hook_strength": 4,
          "representative_quality": 4,
          "title_copy_quality": 4
        }
      ]
    },
    {
      "alignment_confidence": "high",
      "assessment": "三条均反驳“靠硬喊上高音”，共同强调通道、腔体和位置的作用；这是与“高音通道及腹式吸气”不同的误区纠正需求。",
      "canonical_topic": "高音不是靠硬喊",
      "cluster_id": "t061",
      "members": [
        {
          "anonymous_system_id": "Q7",
          "assessment": "x",
          "candidate_id": "candidate_638470bcf20511aa",
          "claim_fidelity": 4,
          "editorial_value": 4,
          "expression_completeness": 4,
          "highlight_id": "h06",
          "hook_strength": 4,
          "representative_quality": 3,
          "title_copy_quality": 4
        },
        {
          "anonymous_system_id": "R2",
          "assessment": "x",
          "candidate_id": "candidate_638470bcf20511aa",
          "claim_fidelity": 4,
          "editorial_value": 4,
          "expression_completeness": 4,
          "highlight_id": "h08",
          "hook_strength": 4,
          "representative_quality": 4,
          "title_copy_quality": 4
        },
        {
          "anonymous_system_id": "M4",
          "assessment": "x",
          "candidate_id": "candidate_638470bcf20511aa",
          "claim_fidelity": 4,
          "editorial_value": 4,
          "expression_completeness": 4,
          "highlight_id": "h05",
          "hook_strength": 4,
          "representative_quality": 4,
          "title_copy_quality": 4
        }
      ]
    },
    {
      "alignment_confidence": "high",
      "assessment": "两个方案均使用同一候选讨论变声期前后的音色困惑。候选主体主要是设问，M4对需要接后文解释的边界交代更准确。",
      "canonical_topic": "青春期变声与音色变化",
      "cluster_id": "t071",
      "members": [
        {
          "anonymous_system_id": "Q7",
          "assessment": "x",
          "candidate_id": "candidate_7c52ff6875a16a62",
          "claim_fidelity": 3,
          "editorial_value": 3,
          "expression_completeness": 2,
          "highlight_id": "h10",
          "hook_strength": 3,
          "representative_quality": 2,
          "title_copy_quality": 3
        },
        {
          "anonymous_system_id": "M4",
          "assessment": "x",
          "candidate_id": "candidate_7c52ff6875a16a62",
          "claim_fidelity": 4,
          "editorial_value": 3,
          "expression_completeness": 2,
          "highlight_id": "h10",
          "hook_strength": 4,
          "representative_quality": 3,
          "title_copy_quality": 4
        }
      ]
    },
    {
      "alignment_confidence": "high",
      "assessment": "三条都区分修音美化与演唱者本身的发声、共鸣能力；R2和M4的高光句直接落在绑定候选内且信息更完整。",
      "canonical_topic": "修音不能替代演唱基本功",
      "cluster_id": "t081",
      "members": [
        {
          "anonymous_system_id": "Q7",
          "assessment": "x",
          "candidate_id": "candidate_e27d41447dbfb889",
          "claim_fidelity": 3,
          "editorial_value": 4,
          "expression_completeness": 3,
          "highlight_id": "h08",
          "hook_strength": 4,
          "representative_quality": 3,
          "title_copy_quality": 3
        },
        {
          "anonymous_system_id": "R2",
          "assessment": "x",
          "candidate_id": "candidate_e27d41447dbfb889",
          "claim_fidelity": 4,
          "editorial_value": 4,
          "expression_completeness": 4,
          "highlight_id": "h11",
          "hook_strength": 4,
          "representative_quality": 4,
          "title_copy_quality": 4
        },
        {
          "anonymous_system_id": "M4",
          "assessment": "x",
          "candidate_id": "candidate_e27d41447dbfb889",
          "claim_fidelity": 4,
          "editorial_value": 4,
          "expression_completeness": 4,
          "highlight_id": "h02",
          "hook_strength": 4,
          "representative_quality": 4,
          "title_copy_quality": 4
        }
      ]
    },
    {
      "alignment_confidence": "high",
      "assessment": "均解释高音卡住、嗓子疼时应检查整体发声与呼吸通道，区别于单独反驳硬喊高音的内容。",
      "canonical_topic": "高音卡住时的发声通道与腹式吸气",
      "cluster_id": "t091",
      "members": [
        {
          "anonymous_system_id": "Q7",
          "assessment": "x",
          "candidate_id": "candidate_e3f2a57d5e929402",
          "claim_fidelity": 4,
          "editorial_value": 4,
          "expression_completeness": 3,
          "highlight_id": "h02",
          "hook_strength": 4,
          "representative_quality": 3,
          "title_copy_quality": 4
        },